{
  "Año": 1807,
  "datos": [
    {
      "PDF": "2043169.pdf",
      "día_periódico": "15/03/1807",
      "hallazgos": [
        {
          "autor": null,
          "traductor": null,
          "título": "Todas las vidas",
          "número_de_tomos": null,
          "formato": null,
          "encuadernación": null,
          "precio": null,
          "lugares_de_venta": "Librería de Alonso, frente à las Gradas de San Felipe el Real",
          "página_pdf": 2,
          "página_periódico": 294,
          "transcripción": "Todas las vidas están escritas con amenidad, sencillez y gusto: de un poeta se pasa á un escritor profundo : no se nota en ellas ni la vil adulacion, ni la sátira mordaz : la gravedad y moderacion del autor son una prueba de su imparcialidad ; y al leer su obra se nos recuerda aquella institucion del antiguo Egipto que traia á los ciudadanos al tribunal de la opinion, con la diferencia de que allí no comparecían sino despues de muertos ; y que en estas Memorias se exerce sobre los vivos el útil poder de la censura. Véndense en la Librería de Alonso, frente à las Gradas de San Felipe el Real."
        }
      ]
    },
    {
      "PDF": "2043220.pdf",
      "día_periódico": "07/05/1807",
      "hallazgos": []
    },
    {
      "PDF": "2043236.pdf",
      "día_periódico": "23/05/1807",
      "hallazgos": [
        {
          "autor": "J. de la Tynna",
          "traductor": null,
          "título": "Almanak du commerce de Paris &c. Almanak del comercio de París, de los Departamentos y de las principales Plazas extrangeras, para el año de 1807",
          "número_de_tomos": "Un volúmen en 8.º",
          "formato": "8.º",
          "encuadernación": null,
          "precio": "8 francos á la rústica",
          "lugares_de_venta": null,
          "página_pdf": 1,
          "página_periódico": 569,
          "transcripción": "Almanak du commerce de Paris &c. Almanak del comercio de París, de los Departamentos y de las principales Plazas extrangeras, para el año de 1807. Por J. de la Tynna, individuo de la Sociedad de fomento de la industria francesa. Un volúmen en 8.º: su precio 8 francos á la rústica. Esta obra contiene los fabricantes, negociantes, banqueros, misionistas, corredores y mercaderes principales de París; el Banco de Francia; los nuevos números de las Casas de París; las Cámaras de comercio; las Cámaras consultivas de fábricas, artes, y oficios; las Bolsas de comercio; las principales ferias de Francia y extrangeras; privilegios de invenciones y unas tablas de las monedas de cuenta de todos los países del mundo, y del par en todos los cambios recíprocos de las Plazas calculados en oro y en plata, por la primera vez, segun el nuevo sistema monetario."
        },
        {
          "autor": null,
          "traductor": null,
          "título": "Almanak portatif des commercans de Paris &c. Almanak portátil de los comerciantes de París para el año de 1807",
          "número_de_tomos": "Un volúmen en 24",
          "formato": "24",
          "encuadernación": null,
          "precio": "2 francos",
          "lugares_de_venta": "París, en el Despacho del Diario de comercio",
          "página_pdf": 2,
          "página_periódico": 570,
          "transcripción": "Almanak portatif des commercans de Paris &c. Almanak portátil de los comerciantes de París para el año de 1807, que contiene los nombres y habitaciones de los banqueros, negociantes y demás clases que que exercen el comercio. Un volúmen en 24: su precio 2 francos. París, en el Despacho del Diario de comercio."
        },
        {
          "autor": "F. Goffaux",
          "traductor": null,
          "título": "Epoques principales de l' histoire &c. Épocas principales de la historia: obra que ha de servir de explicacion á la Tabla Chronométrica",
          "número_de_tomos": "Un volúmen en 8.º",
          "formato": "8.º",
          "encuadernación": null,
          "precio": "6 francos",
          "lugares_de_venta": "París, en casa de Bertrand",
          "página_pdf": 2,
          "página_periódico": 570,
          "transcripción": "Epoques principales de l' histoire &c. Épocas principales de la historia; obra que ha de servir de explicacion á la Tabla Chronométrica, que indica el origen, progresos, duracion y caida de los imperios, por F. Goffaux, Profesor en el Liceo imperial: segunda edicion revista y aumentada. Un volúmen en 8.º con la Tabla Chronométrica iluminada en papel Holanda: su precio 6 francos. París, en casa de Bertrand. Se dice con razon que la geografía y la cronología son los ojos de la historia, pues sin la instruccion en una y otra no hay sino confusion é incertidumbre acerca de los hechos y de los sitios en que han pasado. Así, todas las obras que facilitan este estudio, y mas si son poco voluminosas, no pueden méeos de ser útiles al público. Esta de las Épocas de la historia contiene una narracion sucinta de los principales sucesos de cada país, tanto antiguos como modernos, con sus fechas; y además su objeto principal es servir de texto ó explicacion á una Tabla Chronométrica de los principales sucesos de la historia desde la destruccion de Troya hasta nuestros días."
        }
      ]
    },
    {
      "PDF": "2043252.pdf",
      "día_periódico": "03/06/1807",
      "hallazgos": []
    },
    {
      "PDF": "2043263.pdf",
      "día_periódico": "19/06/1807",
      "hallazgos": []
    },
    {
      "PDF": "2045325.pdf",
      "día_periódico": "06/07/1807",
      "hallazgos": []
    },
    {
      "PDF": "2045343.pdf",
      "día_periódico": "14/07/1807",
      "hallazgos": [
        {
          "autor": null,
          "traductor": null,
          "título": "Dos Casas en la Real Isla de Leon, calle de Santa Teresa, (conocida por la de las Pitas)",
          "número_de_tomos": null,
          "formato": null,
          "encuadernación": null,
          "precio": null,
          "lugares_de_venta": "Don Domingo Antonio de Vivanco, calle de las Descalzas núm. 553; o Doña Manuel Polanco, frente de la Iglesia mayor",
          "página_pdf": 2,
          "página_periódico": 778,
          "transcripción": "Se venden dos Casas en la Real Isla de Leon, calle de Santa Teresa, (conocida por la de las Pitas), lo que se avisa al Público, para que si algún sugeto quisiese tratar de su compra, pueda acudir à la de Don Domingo Antonio de Vivanco, calle de las Descalzas núm. 553 quien manifestará sus aprecios y admitirá sus proposiciones; ó en la dicha Real Isla de Leon, à la de Doña Manuel Polanco, frente de la Iglesia mayor; precediendo si louviesen por conveniente inspeccionar dichas fincas, las quales se permitirá por los inquilinos que las ocupan que sean reconocidas."
        }
      ]
    },
    {
      "PDF": "2045375.pdf",
      "día_periódico": "26/07/1807",
      "hallazgos": []
    },
    {
      "PDF": "2045412.pdf",
      "día_periódico": "09/08/1807",
      "hallazgos": []
    },
    {
      "PDF": "2045432.pdf",
      "día_periódico": "24/08/1807",
      "hallazgos": []
    },
    {
      "PDF": "2045447.pdf",
      "día_periódico": "08/09/1807",
      "hallazgos": []
    },
    {
      "PDF": "2045469.pdf",
      "día_periódico": "30/09/1807",
      "hallazgos": [
        {
          "autor": null,
          "traductor": null,
          "título": "Hacienda con el nombre de Atalaya alta, término de la Ciudad de Carmona",
          "número_de_tomos": null,
          "formato": null,
          "encuadernación": null,
          "precio": null,
          "lugares_de_venta": "Se presenta el anuncio en Sevilla, habiéndose de rematar en sus Casas el día 20 del próximo mes de Octubre por la mañana",
          "página_pdf": 4,
          "página_periódico": 1692,
          "transcripción": "Don Carlos de Gand y Don Josef de Checa, vecinos de Sevilla, Albaceas testamentarios de Don Luis Josef Manteau, y en uso de las facultades que les están concedidas tratan de vender una Hacienda con el nombre de Atalaya alta, término de la Ciudad de Carmona, que se compone de Oficinas altas y baxas unidas, con dos molinos de moler aceytunas, dos almacenes cubiertos y otro de sol, que pueden guardar treinta mil arrobas de aceyte; un Granero, Casa de Tareeros, otra para Ganaderos del de Cerda, con capilla, zahurdas, caballerizas, un tinaon, pozo, pilas, alberga zurizal, pajar, pesebreras; y contiguo à este caserio, un huerto y huerta de suelo y arboleda, con su pozo noriado, y en treinta suertes y pedazos, quinientas y ochenta y siete aranzadas, y treinta y nueve pies de olivos, y entre ellos repartidos cerca de cinco mil pinos mayores y menores. Para que llegue à noticia de todos se inserta el presente aviso para que quien quiera hacer postura se presente à dichos Albaceas en Sevilla, habiéndose de rematar en sus Casas el día 20 del próximo mes de Octubre por la mañana."
        }
      ]
    },
    {
      "PDF": "2045480.pdf",
      "día_periódico": "11/10/1807",
      "hallazgos": []
    },
    {
      "PDF": "2045492.pdf",
      "día_periódico": "23/10/1807",
      "hallazgos": []
    },
    {
      "PDF": "2045503.pdf",
      "día_periódico": "03/11/1807",
      "hallazgos": []
    },
    {
      "PDF": "2045524.pdf",
      "día_periódico": "26/11/1807",
      "hallazgos": []
    },
    {
      "PDF": "2045542.pdf",
      "día_periódico": "14/12/1807",
      "hallazgos": []
    },
    {
      "PDF": "2045553.pdf",
      "día_periódico": "25/12/1807",
      "hallazgos": []
    },
    {
      "PDF": "combined.pdf",
      "Año": 1807,
      "datos": [
        {
          "PDF": "2043169.pdf",
          "día_periódico": "15/03/1807",
          "hallazgos": [
            {
              "autor": null,
              "traductor": null,
              "título": "Todas las vidas",
              "número_de_tomos": null,
              "formato": null,
              "encuadernación": null,
              "precio": null,
              "lugares_de_venta": "Librería de Alonso, frente à las Gradas de San Felipe el Real",
              "página_pdf": 2,
              "página_periódico": 294,
              "transcripción": "Todas las vidas están escritas con amenidad, sencillez y gusto: de un poeta se pasa á un escritor profundo : no se nota en ellas ni la vil adulacion, ni la sátira mordaz : la gravedad y moderacion del autor son una prueba de su imparcialidad ; y al leer su obra se nos recuerda aquella institucion del antiguo Egipto que traia á los ciudadanos al tribunal de la opinion, con la diferencia de que allí no comparecían sino despues de muertos ; y que en estas Memorias se exerce sobre los vivos el útil poder de la censura. Véndense en la Librería de Alonso, frente à las Gradas de San Felipe el Real."
            }
          ]
        },
        {
          "PDF": "2043220.pdf",
          "día_periódico": "07/05/1807",
          "hallazgos": []
        },
        {
          "PDF": "2043236.pdf",
          "día_periódico": "23/05/1807",
          "hallazgos": [
            {
              "autor": "J. de la Tynna",
              "traductor": null,
              "título": "Almanak du commerce de Paris &c. Almanak del comercio de París, de los Departamentos y de las principales Plazas extrangeras, para el año de 1807",
              "número_de_tomos": "Un volúmen en 8.º",
              "formato": "8.º",
              "encuadernación": null,
              "precio": "8 francos á la rústica",
              "lugares_de_venta": null,
              "página_pdf": 1,
              "página_periódico": 569,
              "transcripción": "Almanak du commerce de Paris &c. Almanak del comercio de París, de los Departamentos y de las principales Plazas extrangeras, para el año de 1807. Por J. de la Tynna, individuo de la Sociedad de fomento de la industria francesa. Un volúmen en 8.º: su precio 8 francos á la rústica. Esta obra contiene los fabricantes, negociantes, banqueros, misionistas, corredores y mercaderes principales de París; el Banco de Francia; los nuevos números de las Casas de París; las Cámaras de comercio; las Cámaras consultivas de fábricas, artes, y oficios; las Bolsas de comercio; las principales ferias de Francia y extrangeras; privilegios de invenciones y unas tablas de las monedas de cuenta de todos los países del mundo, y del par en todos los cambios recíprocos de las Plazas calculados en oro y en plata, por la primera vez, segun el nuevo sistema monetario."
            },
            {
              "autor": null,
              "traductor": null,
              "título": "Almanak portatif des commercans de Paris &c. Almanak portátil de los comerciantes de París para el año de 1807",
              "número_de_tomos": "Un volúmen en 24",
              "formato": "24",
              "encuadernación": null,
              "precio": "2 francos",
              "lugares_de_venta": "París, en el Despacho del Diario de comercio",
              "página_pdf": 2,
              "página_periódico": 570,
              "transcripción": "Almanak portatif des commercans de Paris &c. Almanak portátil de los comerciantes de París para el año de 1807, que contiene los nombres y habitaciones de los banqueros, negociantes y demás clases que que exercen el comercio. Un volúmen en 24: su precio 2 francos. París, en el Despacho del Diario de comercio."
            },
            {
              "autor": "F. Goffaux",
              "traductor": null,
              "título": "Epoques principales de l' histoire &c. Épocas principales de la historia: obra que ha de servir de explicacion á la Tabla Chronométrica",
              "número_de_tomos": "Un volúmen en 8.º",
              "formato": "8.º",
              "encuadernación": null,
              "precio": "6 francos",
              "lugares_de_venta": "París, en casa de Bertrand",
              "página_pdf": 2,
              "página_periódico": 570,
              "transcripción": "Epoques principales de l' histoire &c. Épocas principales de la historia; obra que ha de servir de explicacion á la Tabla Chronométrica, que indica el origen, progresos, duracion y caida de los imperios, por F. Goffaux, Profesor en el Liceo imperial: segunda edicion revista y aumentada. Un volúmen en 8.º con la Tabla Chronométrica iluminada en papel Holanda: su precio 6 francos. París, en casa de Bertrand. Se dice con razon que la geografía y la cronología son los ojos de la historia, pues sin la instruccion en una y otra no hay sino confusion é incertidumbre acerca de los hechos y de los sitios en que han pasado. Así, todas las obras que facilitan este estudio, y mas si son poco voluminosas, no pueden méeos de ser útiles al público. Esta de las Épocas de la historia contiene una narracion sucinta de los principales sucesos de cada país, tanto antiguos como modernos, con sus fechas; y además su objeto principal es servir de texto ó explicacion á una Tabla Chronométrica de los principales sucesos de la historia desde la destruccion de Troya hasta nuestros días."
            }
          ]
        },
        {
          "PDF": "2043252.pdf",
          "día_periódico": "03/06/1807",
          "hallazgos": []
        },
        {
          "PDF": "2043263.pdf",
          "día_periódico": "19/06/1807",
          "hallazgos": []
        },
        {
          "PDF": "2045325.pdf",
          "día_periódico": "06/07/1807",
          "hallazgos": []
        },
        {
          "PDF": "2045343.pdf",
          "día_periódico": "14/07/1807",
          "hallazgos": [
            {
              "autor": null,
              "traductor": null,
              "título": "Dos Casas en la Real Isla de Leon, calle de Santa Teresa, (conocida por la de las Pitas)",
              "número_de_tomos": null,
              "formato": null,
              "encuadernación": null,
              "precio": null,
              "lugares_de_venta": "Don Domingo Antonio de Vivanco, calle de las Descalzas núm. 553; o Doña Manuel Polanco, frente de la Iglesia mayor",
              "página_pdf": 2,
              "página_periódico": 778,
              "transcripción": "Se venden dos Casas en la Real Isla de Leon, calle de Santa Teresa, (conocida por la de las Pitas), lo que se avisa al Público, para que si algún sugeto quisiese tratar de su compra, pueda acudir à la de Don Domingo Antonio de Vivanco, calle de las Descalzas núm. 553 quien manifestará sus aprecios y admitirá sus proposiciones; ó en la dicha Real Isla de Leon, à la de Doña Manuel Polanco, frente de la Iglesia mayor; precediendo si louviesen por conveniente inspeccionar dichas fincas, las quales se permitirá por los inquilinos que las ocupan que sean reconocidas."
            }
          ]
        },
        {
          "PDF": "2045375.pdf",
          "día_periódico": "26/07/1807",
          "hallazgos": []
        },
        {
          "PDF": "2045412.pdf",
          "día_periódico": "09/08/1807",
          "hallazgos": []
        },
        {
          "PDF": "2045432.pdf",
          "día_periódico": "24/08/1807",
          "hallazgos": []
        },
        {
          "PDF": "2045447.pdf",
          "día_periódico": "08/09/1807",
          "hallazgos": []
        },
        {
          "PDF": "2045469.pdf",
          "día_periódico": "30/09/1807",
          "hallazgos": [
            {
              "autor": null,
              "traductor": null,
              "título": "Hacienda con el nombre de Atalaya alta, término de la Ciudad de Carmona",
              "número_de_tomos": null,
              "formato": null,
              "encuadernación": null,
              "precio": null,
              "lugares_de_venta": "Se presenta el anuncio en Sevilla, habiéndose de rematar en sus Casas el día 20 del próximo mes de Octubre por la mañana",
              "página_pdf": 4,
              "página_periódico": 1692,
              "transcripción": "Don Carlos de Gand y Don Josef de Checa, vecinos de Sevilla, Albaceas testamentarios de Don Luis Josef Manteau, y en uso de las facultades que les están concedidas tratan de vender una Hacienda con el nombre de Atalaya alta, término de la Ciudad de Carmona, que se compone de Oficinas altas y baxas unidas, con dos molinos de moler aceytunas, dos almacenes cubiertos y otro de sol, que pueden guardar treinta mil arrobas de aceyte; un Granero, Casa de Tareeros, otra para Ganaderos del de Cerda, con capilla, zahurdas, caballerizas, un tinaon, pozo, pilas, alberga zurizal, pajar, pesebreras; y contiguo à este caserio, un huerto y huerta de suelo y arboleda, con su pozo noriado, y en treinta suertes y pedazos, quinientas y ochenta y siete aranzadas, y treinta y nueve pies de olivos, y entre ellos repartidos cerca de cinco mil pinos mayores y menores. Para que llegue à noticia de todos se inserta el presente aviso para que quien quiera hacer postura se presente à dichos Albaceas en Sevilla, habiéndose de rematar en sus Casas el día 20 del próximo mes de Octubre por la mañana."
            }
          ]
        },
        {
          "PDF": "2045480.pdf",
          "día_periódico": "11/10/1807",
          "hallazgos": []
        },
        {
          "PDF": "2045492.pdf",
          "día_periódico": "23/10/1807",
          "hallazgos": []
        },
        {
          "PDF": "2045503.pdf",
          "día_periódico": "03/11/1807",
          "hallazgos": []
        },
        {
          "PDF": "2045524.pdf",
          "día_periódico": "26/11/1807",
          "hallazgos": []
        },
        {
          "PDF": "2045542.pdf",
          "día_periódico": "14/12/1807",
          "hallazgos": []
        },
        {
          "PDF": "2045553.pdf",
          "día_periódico": "25/12/1807",
          "hallazgos": []
        }
      ]
    }
  ]
}
